{
  "$schema": "https://json-schema.org/draft/2020-12/schema",
  "type": "object",
  "properties": {
    "protocol": {
      "type": "string",
      "const": "https://jinn.network/protocols/trajectory/1.0"
    },
    "source": {
      "type": "object",
      "properties": {
        "nativeTrace": {
          "type": "object",
          "properties": {
            "name": {
              "type": "string",
              "minLength": 1
            },
            "mediaType": {
              "type": "string",
              "minLength": 1
            },
            "uri": {
              "type": "string",
              "minLength": 1
            },
            "digest": {
              "type": "object",
              "properties": {
                "sha256": {
                  "type": "string",
                  "pattern": "^[0-9a-f]{64}$"
                }
              },
              "required": [
                "sha256"
              ],
              "additionalProperties": false
            }
          },
          "required": [
            "digest"
          ],
          "additionalProperties": {
            "$ref": "#/$defs/JsonExtensionValue"
          },
          "propertyNames": {
            "anyOf": [
              {
                "enum": [
                  "name",
                  "mediaType",
                  "uri",
                  "digest"
                ]
              },
              {
                "pattern": "^(?:[A-Za-z][A-Za-z0-9-]*(?:\\.[A-Za-z][A-Za-z0-9-]*)+|[A-Za-z][A-Za-z0-9+.-]*:[^\\s]+)$"
              }
            ]
          }
        },
        "formatIri": {
          "type": "string",
          "pattern": "^[A-Za-z][A-Za-z0-9+.-]*:[^\\s]+$"
        }
      },
      "required": [
        "nativeTrace",
        "formatIri"
      ],
      "additionalProperties": false
    },
    "derivation": {
      "type": "object",
      "properties": {
        "decoderId": {
          "type": "string",
          "pattern": "^[a-z][a-z0-9-]*$"
        },
        "decoderVersion": {
          "type": "string",
          "minLength": 1
        },
        "vocabularyProfile": {
          "type": "string",
          "const": "https://jinn.network/profiles/trajectory-vocabulary/1.0"
        }
      },
      "required": [
        "decoderId",
        "decoderVersion",
        "vocabularyProfile"
      ],
      "additionalProperties": false
    },
    "timebase": {
      "type": "string",
      "enum": [
        "source-epoch-ns",
        "synthetic-ordinal"
      ]
    },
    "traceId": {
      "type": "string",
      "pattern": "^[0-9a-f]{32}$"
    },
    "spans": {
      "type": "array",
      "items": {
        "type": "object",
        "properties": {
          "spanId": {
            "type": "string",
            "pattern": "^[0-9a-f]{16}$"
          },
          "parentSpanId": {
            "anyOf": [
              {
                "type": "string",
                "pattern": "^[0-9a-f]{16}$"
              },
              {
                "type": "null"
              }
            ]
          },
          "name": {
            "type": "string",
            "minLength": 1
          },
          "kind": {
            "anyOf": [
              {
                "type": "number",
                "const": 1
              },
              {
                "type": "number",
                "const": 2
              },
              {
                "type": "number",
                "const": 3
              },
              {
                "type": "number",
                "const": 4
              },
              {
                "type": "number",
                "const": 5
              }
            ]
          },
          "startTimeUnixNano": {
            "type": "string",
            "pattern": "^(0|[1-9]\\d{0,18}|1[0-7]\\d{0,18}|18[0-3]\\d{0,17}|184[0-3]\\d{0,16}|1844[0-6]\\d{0,15}|18446[0-6]\\d{0,14}|184467[0-3]\\d{0,13}|1844674[0-3]\\d{0,12}|18446744[0-0]\\d{0,11}|184467440[0-6]\\d{0,10}|1844674407[0-2]\\d{0,9}|18446744073[0-6]\\d{0,8}|184467440737[0-0]\\d{0,7}|1844674407370[0-8]\\d{0,6}|18446744073709[0-4]\\d{0,5}|184467440737095[0-4]\\d{0,4}|1844674407370955[0-1]\\d{0,3}|18446744073709551[0-5]\\d{0,2}|184467440737095516[0-1]\\d{0,1}|1844674407370955161[0-5])$"
          },
          "endTimeUnixNano": {
            "type": "string",
            "pattern": "^(0|[1-9]\\d{0,18}|1[0-7]\\d{0,18}|18[0-3]\\d{0,17}|184[0-3]\\d{0,16}|1844[0-6]\\d{0,15}|18446[0-6]\\d{0,14}|184467[0-3]\\d{0,13}|1844674[0-3]\\d{0,12}|18446744[0-0]\\d{0,11}|184467440[0-6]\\d{0,10}|1844674407[0-2]\\d{0,9}|18446744073[0-6]\\d{0,8}|184467440737[0-0]\\d{0,7}|1844674407370[0-8]\\d{0,6}|18446744073709[0-4]\\d{0,5}|184467440737095[0-4]\\d{0,4}|1844674407370955[0-1]\\d{0,3}|18446744073709551[0-5]\\d{0,2}|184467440737095516[0-1]\\d{0,1}|1844674407370955161[0-5])$"
          },
          "attributes": {
            "type": "array",
            "items": {
              "type": "object",
              "properties": {
                "key": {
                  "type": "string",
                  "enum": [
                    "gen_ai.operation.name",
                    "gen_ai.provider.name",
                    "gen_ai.request.model",
                    "gen_ai.response.model",
                    "gen_ai.usage.input_tokens",
                    "gen_ai.usage.output_tokens",
                    "gen_ai.tool.name",
                    "gen_ai.tool.call.id",
                    "gen_ai.tool.type",
                    "gen_ai.agent.name",
                    "gen_ai.conversation.id",
                    "jinn.trajectory.turn.role",
                    "jinn.trajectory.source.ordinal",
                    "jinn.trajectory.outcome"
                  ]
                },
                "value": {
                  "type": "object",
                  "oneOf": [
                    {
                      "type": "object",
                      "required": [
                        "stringValue"
                      ],
                      "properties": {
                        "stringValue": {
                          "type": "string"
                        }
                      },
                      "additionalProperties": false
                    },
                    {
                      "type": "object",
                      "required": [
                        "boolValue"
                      ],
                      "properties": {
                        "boolValue": {
                          "type": "boolean"
                        }
                      },
                      "additionalProperties": false
                    },
                    {
                      "type": "object",
                      "required": [
                        "intValue"
                      ],
                      "properties": {
                        "intValue": {
                          "type": "string",
                          "pattern": "^-?(0|[1-9]\\d*)$"
                        }
                      },
                      "additionalProperties": false
                    },
                    {
                      "type": "object",
                      "required": [
                        "doubleValue"
                      ],
                      "properties": {
                        "doubleValue": {
                          "type": "string",
                          "pattern": "^-?\\d+(\\.\\d+)?$"
                        }
                      },
                      "additionalProperties": false
                    }
                  ]
                }
              },
              "required": [
                "key",
                "value"
              ],
              "additionalProperties": false
            }
          },
          "events": {
            "type": "array",
            "items": {
              "type": "object",
              "properties": {
                "timeUnixNano": {
                  "type": "string",
                  "pattern": "^(0|[1-9]\\d{0,18}|1[0-7]\\d{0,18}|18[0-3]\\d{0,17}|184[0-3]\\d{0,16}|1844[0-6]\\d{0,15}|18446[0-6]\\d{0,14}|184467[0-3]\\d{0,13}|1844674[0-3]\\d{0,12}|18446744[0-0]\\d{0,11}|184467440[0-6]\\d{0,10}|1844674407[0-2]\\d{0,9}|18446744073[0-6]\\d{0,8}|184467440737[0-0]\\d{0,7}|1844674407370[0-8]\\d{0,6}|18446744073709[0-4]\\d{0,5}|184467440737095[0-4]\\d{0,4}|1844674407370955[0-1]\\d{0,3}|18446744073709551[0-5]\\d{0,2}|184467440737095516[0-1]\\d{0,1}|1844674407370955161[0-5])$"
                },
                "name": {
                  "type": "string",
                  "minLength": 1
                },
                "attributes": {
                  "type": "array",
                  "items": {
                    "type": "object",
                    "properties": {
                      "key": {
                        "type": "string",
                        "enum": [
                          "gen_ai.operation.name",
                          "gen_ai.provider.name",
                          "gen_ai.request.model",
                          "gen_ai.response.model",
                          "gen_ai.usage.input_tokens",
                          "gen_ai.usage.output_tokens",
                          "gen_ai.tool.name",
                          "gen_ai.tool.call.id",
                          "gen_ai.tool.type",
                          "gen_ai.agent.name",
                          "gen_ai.conversation.id",
                          "jinn.trajectory.turn.role",
                          "jinn.trajectory.source.ordinal",
                          "jinn.trajectory.outcome"
                        ]
                      },
                      "value": {
                        "type": "object",
                        "oneOf": [
                          {
                            "type": "object",
                            "required": [
                              "stringValue"
                            ],
                            "properties": {
                              "stringValue": {
                                "type": "string"
                              }
                            },
                            "additionalProperties": false
                          },
                          {
                            "type": "object",
                            "required": [
                              "boolValue"
                            ],
                            "properties": {
                              "boolValue": {
                                "type": "boolean"
                              }
                            },
                            "additionalProperties": false
                          },
                          {
                            "type": "object",
                            "required": [
                              "intValue"
                            ],
                            "properties": {
                              "intValue": {
                                "type": "string",
                                "pattern": "^-?(0|[1-9]\\d*)$"
                              }
                            },
                            "additionalProperties": false
                          },
                          {
                            "type": "object",
                            "required": [
                              "doubleValue"
                            ],
                            "properties": {
                              "doubleValue": {
                                "type": "string",
                                "pattern": "^-?\\d+(\\.\\d+)?$"
                              }
                            },
                            "additionalProperties": false
                          }
                        ]
                      }
                    },
                    "required": [
                      "key",
                      "value"
                    ],
                    "additionalProperties": false
                  }
                }
              },
              "required": [
                "timeUnixNano",
                "name",
                "attributes"
              ],
              "additionalProperties": false
            }
          },
          "status": {
            "type": "object",
            "properties": {
              "code": {
                "anyOf": [
                  {
                    "type": "number",
                    "const": 0
                  },
                  {
                    "type": "number",
                    "const": 1
                  },
                  {
                    "type": "number",
                    "const": 2
                  }
                ]
              },
              "message": {
                "type": "string"
              }
            },
            "required": [
              "code"
            ],
            "additionalProperties": false
          }
        },
        "required": [
          "spanId",
          "parentSpanId",
          "name",
          "kind",
          "startTimeUnixNano",
          "endTimeUnixNano",
          "attributes",
          "events",
          "status"
        ],
        "additionalProperties": false
      }
    },
    "completeness": {
      "type": "object",
      "properties": {
        "decoded": {
          "type": "string",
          "enum": [
            "full",
            "partial",
            "empty"
          ]
        },
        "skipped": {
          "type": "integer",
          "minimum": 0,
          "maximum": 9007199254740991
        },
        "reason": {
          "type": "string",
          "minLength": 1
        }
      },
      "required": [
        "decoded"
      ],
      "additionalProperties": false
    }
  },
  "required": [
    "protocol",
    "source",
    "derivation",
    "timebase",
    "traceId",
    "spans",
    "completeness"
  ],
  "additionalProperties": {
    "$ref": "#/$defs/JsonExtensionValue"
  },
  "$id": "https://jinn.network/records/trajectory/1.0/schema",
  "title": "Jinn Trajectory record",
  "propertyNames": {
    "anyOf": [
      {
        "enum": [
          "protocol",
          "source",
          "derivation",
          "timebase",
          "traceId",
          "spans",
          "completeness"
        ]
      },
      {
        "pattern": "^(?:[A-Za-z][A-Za-z0-9-]*(?:\\.[A-Za-z][A-Za-z0-9-]*)+|[A-Za-z][A-Za-z0-9+.-]*:[^\\s]+)$"
      }
    ]
  },
  "$defs": {
    "JsonExtensionValue": {
      "anyOf": [
        {
          "type": "string"
        },
        {
          "type": "integer",
          "minimum": -9007199254740991,
          "maximum": 9007199254740991
        },
        {
          "type": "boolean"
        },
        {
          "type": "null"
        },
        {
          "type": "array",
          "items": {
            "$ref": "#/$defs/JsonExtensionValue"
          }
        },
        {
          "type": "object",
          "propertyNames": {
            "pattern": "^(?:[A-Za-z][A-Za-z0-9-]*(?:\\.[A-Za-z][A-Za-z0-9-]*)+|[A-Za-z][A-Za-z0-9+.-]*:[^\\s]+)$"
          },
          "additionalProperties": {
            "$ref": "#/$defs/JsonExtensionValue"
          }
        }
      ]
    },
    "AnyValue": {
      "oneOf": [
        {
          "type": "object",
          "required": [
            "stringValue"
          ],
          "properties": {
            "stringValue": {
              "type": "string"
            }
          },
          "additionalProperties": false
        },
        {
          "type": "object",
          "required": [
            "boolValue"
          ],
          "properties": {
            "boolValue": {
              "type": "boolean"
            }
          },
          "additionalProperties": false
        },
        {
          "type": "object",
          "required": [
            "intValue"
          ],
          "properties": {
            "intValue": {
              "type": "string",
              "pattern": "^-?(0|[1-9]\\d{0,18}|1[0-7]\\d{0,18}|18[0-3]\\d{0,17}|184[0-3]\\d{0,16}|1844[0-6]\\d{0,15}|18446[0-6]\\d{0,14}|184467[0-3]\\d{0,13}|1844674[0-3]\\d{0,12}|18446744[0-0]\\d{0,11}|184467440[0-6]\\d{0,10}|1844674407[0-2]\\d{0,9}|18446744073[0-6]\\d{0,8}|184467440737[0-0]\\d{0,7}|1844674407370[0-8]\\d{0,6}|18446744073709[0-4]\\d{0,5}|184467440737095[0-4]\\d{0,4}|1844674407370955[0-1]\\d{0,3}|18446744073709551[0-5]\\d{0,2}|184467440737095516[0-1]\\d{0,1}|1844674407370955161[0-5])$"
            }
          },
          "additionalProperties": false
        },
        {
          "type": "object",
          "required": [
            "doubleValue"
          ],
          "properties": {
            "doubleValue": {
              "type": "string",
              "pattern": "^-?\\d+(\\.\\d+)?$"
            }
          },
          "additionalProperties": false
        }
      ]
    }
  },
  "allOf": [
    {
      "if": {
        "properties": {
          "completeness": {
            "type": "object",
            "properties": {
              "decoded": {
                "const": "full"
              }
            },
            "required": [
              "decoded"
            ]
          }
        },
        "required": [
          "completeness"
        ]
      },
      "then": {
        "properties": {
          "completeness": {
            "properties": {
              "skipped": false
            }
          }
        }
      }
    },
    {
      "if": {
        "properties": {
          "completeness": {
            "type": "object",
            "properties": {
              "decoded": {
                "const": "partial"
              }
            },
            "required": [
              "decoded"
            ]
          }
        },
        "required": [
          "completeness"
        ]
      },
      "then": {
        "properties": {
          "completeness": {
            "required": [
              "skipped"
            ],
            "properties": {
              "skipped": {
                "type": "integer",
                "minimum": 1
              }
            }
          }
        }
      }
    },
    {
      "if": {
        "properties": {
          "completeness": {
            "type": "object",
            "properties": {
              "decoded": {
                "const": "empty"
              }
            },
            "required": [
              "decoded"
            ]
          }
        },
        "required": [
          "completeness"
        ]
      },
      "then": {
        "properties": {
          "spans": {
            "maxItems": 0
          }
        }
      }
    }
  ],
  "$comment": "Structural validation only. Runtime refinements not expressible here: traceId must equal the value derived from source.nativeTrace.digest, formatIri, and derivation; each spanId must equal the value derived from traceId and its ordinal; parentSpanId must reference an earlier span in this record; attributes must be sorted by key and unique; source.execution is removed — execution binding is via derivation attestation and forward link. JsonExtensionValue numbers are I-JSON safe integers only (±9007199254740991). AnyValue must carry exactly one OTLP variant (stringValue, boolValue, intValue, or doubleValue). OTLP uint64 timestamps are decimal strings 0..18446744073709551615; intValue is int64 decimal."
}
