{"completeness":{"decoded":"full"},"derivation":{"decoderId":"claude-code-stream-json","decoderVersion":"1.0.0","vocabularyProfile":"https://jinn.network/profiles/trajectory-vocabulary/1.0"},"protocol":"https://jinn.network/protocols/trajectory/1.0","source":{"formatIri":"https://jinn.network/formats/claude-code-stream-json/v1","nativeTrace":{"digest":{"sha256":"aaaaaaaaaaaaaaaaaaaaaaaaaaaaaaaaaaaaaaaaaaaaaaaaaaaaaaaaaaaaaaaa"},"mediaType":"application/x-ndjson","name":"stdout.jsonl"}},"spans":[{"attributes":[{"key":"gen_ai.provider.name","value":{"stringValue":"anthropic"}},{"key":"gen_ai.usage.input_tokens","value":{"intValue":"1024"}}],"endTimeUnixNano":"1","events":[],"kind":3,"name":"chat anthropic/claude-opus-4.6","parentSpanId":null,"spanId":"fab180072eaae661","startTimeUnixNano":"0","status":{"code":1}},{"attributes":[{"key":"gen_ai.tool.call.id","value":{"stringValue":"call_1"}},{"key":"gen_ai.tool.name","value":{"stringValue":"read_file"}}],"endTimeUnixNano":"2","events":[],"kind":1,"name":"execute_tool read_file","parentSpanId":"fab180072eaae661","spanId":"d890422107454e52","startTimeUnixNano":"1","status":{"code":1}}],"timebase":"synthetic-ordinal","traceId":"91dc6db083572baf2195805d023312d8"}